{
  "schema_version": "3.1",
  "decision_version": "1.1",
  "decision_id": "decision-8d2352bc40eee9883dc52fee",
  "result_id": "result-positive-unsupported-no-label-unreadable",
  "snapshot_id": "snapshot-positive-unsupported-no-label-unreadable",
  "policy_version": "policy-v31",
  "threshold_version": "auto-exact-pet-v1",
  "threshold_classification": "PET",
  "auto_threshold_strictly_greater_than": 0.8,
  "status": "unsupported_subject",
  "primary_action": { "kind": "unable", "referent": null },
  "gate_outcomes": {
    "support": false,
    "localization": false,
    "quality": true,
    "ocr_integrity": false,
    "freshness": true,
    "format_policy": true,
    "deterministic_safety": true,
    "no_unknown_blocking": false,
    "version_compatibility": true
  },
  "all_required_gates_pass": false,
  "automatic_completion_eligible": false,
  "candidate_ready": false,
  "evaluated_at": "2026-08-01T10:00:01Z"
}
